[
  {
    "id": "button.elevated",
    "name": "Elevated Button",
    "family": "Buttons",
    "maturity": "complete",
    "maturityPolicy": "manual",
    "publicHeader": "qtmaterial/widgets/buttons/qtmaterialelevatedbutton.h",
    "specType": "ButtonSpec",
    "widgetType": "QtMaterialElevatedButton",
    "testTarget": "tst_elevatedbutton",
    "galleryRoute": "/buttons/elevated",
    "docsPath": "docs/public-api/buttons.md",
    "releaseScope": true,
    "referenceCandidate": false,
    "maturityAxes": {
      "api": 4,
      "rendering": 4,
      "states": 4,
      "accessibility": 4,
      "keyboard": 4,
      "hidpi": 4,
      "rtl": 4,
      "tests": 4,
      "example": 4,
      "docs": 4,
      "lastReviewed": "2026-07-17",
      "gaps": [],
      "nextActions": [
        "Maintain complete status by keeping registry, tests, gallery and documentation evidence in sync."
      ],
      "evidence": {
        "api": [
          "registry entry exists",
          "public header exists: include/qtmaterial/widgets/buttons/qtmaterialelevatedbutton.h",
          "source exists: src/widgets/buttons/qtmaterialelevatedbutton.cpp",
          "variant test `tst_elevatedbutton` is registered",
          "Material automation metadata is explicit"
        ],
        "rendering": [
          "gallery includes maturity rendering coverage",
          "variant rendering can be exercised by `tst_elevatedbutton`",
          "focused ElevatedButton shadow test exists and is registered"
        ],
        "states": [
          "shared contract covers enabled/disabled/focus/activation states",
          "variant test exists for component-specific state behavior"
        ],
        "accessibility": [
          "docs include the Buttons accessibility contract",
          "shared contract includes accessibility checks",
          "focused IconButton/FAB accessibility test exists and is registered"
        ],
        "keyboard": [
          "shared contract covers keyboard activation and disabled non-activation"
        ],
        "hidpi": [
          "shared contract includes DPR 2.0 render smoke",
          "ElevatedButton focused test covers DPR 1.0/1.5/2.0"
        ],
        "rtl": [
          "shared contract includes RTL sizeHint stability",
          "gallery includes RTL preview"
        ],
        "tests": [
          "variant test `tst_elevatedbutton` is registered",
          "shared button contract test exists and is registered",
          "focused test `tst_elevatedbutton_shadow` exists and is registered"
        ],
        "example": [
          "gallery contains marked maturity coverage block"
        ],
        "docs": [
          "buttons.md contains marked maturity contract block"
        ],
        "notes": [
          "Public Elevated Button variant is tracked in the registry.",
          "Shared Buttons maturity contract covers keyboard, accessibility, disabled-state, RTL, and HiDPI smoke behavior.",
          "Elevated-specific maturity requires elevation and shadow rendering to remain covered by variant tests or visual review."
        ]
      }
    }
  },
  {
    "id": "button.extended-fab",
    "name": "Extended Floating Action Button",
    "family": "Buttons",
    "maturity": "complete",
    "publicHeader": "qtmaterial/widgets/buttons/qtmaterialextendedfab.h",
    "specType": "FabSpec",
    "widgetType": "QtMaterialExtendedFab",
    "testTarget": "tst_extendedfab",
    "galleryRoute": "/buttons/extended-fab",
    "docsPath": "docs/public-api/buttons.md",
    "releaseScope": true,
    "maturityPolicy": "manual",
    "referenceCandidate": false,
    "maturityAxes": {
      "api": 4,
      "rendering": 4,
      "states": 4,
      "accessibility": 4,
      "keyboard": 4,
      "hidpi": 4,
      "rtl": 4,
      "tests": 4,
      "example": 4,
      "docs": 4,
      "lastReviewed": "2026-07-17",
      "gaps": [],
      "nextActions": [
        "Maintain complete status by keeping registry, tests, gallery and documentation evidence in sync."
      ],
      "evidence": {
        "api": [
          "registry entry exists",
          "public header exists: include/qtmaterial/widgets/buttons/qtmaterialextendedfab.h",
          "source exists: src/widgets/buttons/qtmaterialextendedfab.cpp",
          "variant test `tst_extendedfab` is registered",
          "Material automation metadata is explicit"
        ],
        "rendering": [
          "gallery includes maturity rendering coverage",
          "variant rendering can be exercised by `tst_extendedfab`"
        ],
        "states": [
          "shared contract covers enabled/disabled/focus/activation states",
          "variant test exists for component-specific state behavior"
        ],
        "accessibility": [
          "docs include the Buttons accessibility contract",
          "shared contract includes accessibility checks",
          "focused IconButton/FAB accessibility test exists and is registered"
        ],
        "keyboard": [
          "shared contract covers keyboard activation and disabled non-activation"
        ],
        "hidpi": [
          "shared contract includes DPR 2.0 render smoke"
        ],
        "rtl": [
          "shared contract includes RTL sizeHint stability",
          "gallery includes RTL preview"
        ],
        "tests": [
          "variant test `tst_extendedfab` is registered",
          "shared button contract test exists and is registered",
          "focused test `tst_icon_fab_accessibility` exists and is registered"
        ],
        "example": [
          "gallery contains marked maturity coverage block"
        ],
        "docs": [
          "buttons.md contains marked maturity contract block"
        ],
        "notes": [
          "Public Extended FAB variant is tracked in the registry.",
          "Shared Buttons maturity contract covers keyboard, accessibility, disabled-state, RTL, and HiDPI smoke behavior."
        ]
      }
    }
  },
  {
    "id": "button.fab",
    "name": "Floating Action Button",
    "family": "Buttons",
    "maturity": "complete",
    "publicHeader": "qtmaterial/widgets/buttons/qtmaterialfab.h",
    "specType": "FabSpec",
    "widgetType": "QtMaterialFab",
    "testTarget": "tst_fab",
    "galleryRoute": "/buttons/fab",
    "docsPath": "docs/public-api/buttons.md",
    "releaseScope": true,
    "maturityPolicy": "manual",
    "referenceCandidate": false,
    "maturityAxes": {
      "api": 4,
      "rendering": 4,
      "states": 4,
      "accessibility": 4,
      "keyboard": 4,
      "hidpi": 4,
      "rtl": "N/A",
      "tests": 4,
      "example": 4,
      "docs": 4,
      "lastReviewed": "2026-07-17",
      "gaps": [],
      "nextActions": [
        "Maintain complete status by keeping registry, tests, gallery and documentation evidence in sync."
      ],
      "evidence": {
        "api": [
          "registry entry exists",
          "public header exists: include/qtmaterial/widgets/buttons/qtmaterialfab.h",
          "source exists: src/widgets/buttons/qtmaterialfab.cpp",
          "variant test `tst_fab` is registered",
          "Material automation metadata is explicit"
        ],
        "rendering": [
          "gallery includes maturity rendering coverage",
          "variant rendering can be exercised by `tst_fab`"
        ],
        "states": [
          "shared contract covers enabled/disabled/focus/activation states",
          "variant test exists for component-specific state behavior"
        ],
        "accessibility": [
          "docs include the Buttons accessibility contract",
          "shared contract includes accessibility checks",
          "focused IconButton/FAB accessibility test exists and is registered"
        ],
        "keyboard": [
          "shared contract covers keyboard activation and disabled non-activation"
        ],
        "hidpi": [
          "shared contract includes DPR 2.0 render smoke"
        ],
        "rtl": [
          "RTL is not applicable to icon-only layout"
        ],
        "tests": [
          "variant test `tst_fab` is registered",
          "shared button contract test exists and is registered",
          "focused test `tst_icon_fab_accessibility` exists and is registered"
        ],
        "example": [
          "gallery contains marked maturity coverage block"
        ],
        "docs": [
          "buttons.md contains marked maturity contract block"
        ],
        "notes": [
          "Public compact FAB variant is tracked in the registry.",
          "Icon-only accessible-name policy is documented and covered by the shared Buttons contract test.",
          "RTL is not applicable to the icon-only compact FAB layout itself."
        ]
      }
    }
  },
  {
    "id": "button.filled",
    "name": "Filled Button",
    "family": "Buttons",
    "maturity": "complete",
    "maturityPolicy": "manual",
    "publicHeader": "qtmaterial/widgets/buttons/qtmaterialfilledbutton.h",
    "specType": "ButtonSpec",
    "widgetType": "QtMaterialFilledButton",
    "testTarget": "tst_filledbutton",
    "galleryRoute": "/buttons/filled",
    "docsPath": "docs/public-api/buttons.md",
    "releaseScope": true,
    "maturityAxes": {
      "api": 4,
      "rendering": 4,
      "states": 4,
      "accessibility": 4,
      "keyboard": 4,
      "hidpi": 4,
      "rtl": 4,
      "tests": 4,
      "example": 4,
      "docs": 4,
      "lastReviewed": "2026-07-17",
      "evidence": {
        "api": [
          "registry entry exists",
          "public header exists: include/qtmaterial/widgets/buttons/qtmaterialfilledbutton.h",
          "source exists: src/widgets/buttons/qtmaterialfilledbutton.cpp",
          "variant test `tst_filledbutton` is registered",
          "Material automation metadata is explicit"
        ],
        "rendering": [
          "gallery includes maturity rendering coverage",
          "variant rendering can be exercised by `tst_filledbutton`"
        ],
        "states": [